ID,v2
2374,"YOU VE WON! Your 4* Costa Del Sol Holiday or å£5000 await collection. Call 09050090044 Now toClaim. SAE, TC s, POBox334, Stockport, SK38xh, Costå£1.50/pm, Max10mins"
2378,Yes watching footie but worried we're going to blow it - Phil Neville?
2379,Any way where are you and what doing.
2380,Yup having my lunch buffet now.. U eat already?
2382,"Aight, text me tonight and we'll see what's up"
2383,"Ask g or iouri, I've told the story like ten times already"
2397,Yar lor wait 4 my mum 2 finish sch then have lunch lor... I whole morning stay at home clean my room now my room quite clean... Hee...
2400,U dun say so early hor... U c already then say...
2402,Jos ask if u wana meet up?
2403,"I'm gonna be home soon and i don't want to talk about this stuff anymore tonight, k? I've cried enough today."
2405,"Good morning, my Love ... I go to sleep now and wish you a great day full of feeling better and opportunity ... You are my last thought babe, I LOVE YOU *kiss*"
2407,"Call 09094100151 to use ur mins! Calls cast 10p/min (mob vary). Service provided by AOM, just GBP5/month. AOM Box61,M60 1ER until u stop. Ages 18+ only!"
2408,Is xy going 4 e lunch?
2422,Yes fine 
2424,What happen dear tell me
2426,There is a first time for everything :)
2427,Gokila is talking with you aha:)
2434,"That means you got an A in epi, she.s fine. She.s here now."
2444,Nobody can decide where to eat and dad wants Chinese
2451,Gud mrng dear have a nice day
2454,Did u got that persons story
2456,Ok. There may be a free gym about.
2457,\HEY KATE
2458,Well. Balls. Time to make calls
2467,This pen thing is beyond a joke. Wont a Biro do? Don't do a masters as can't do this ever again! 
2478,"I jus hope its true that  missin me cos i'm really missin him! You haven't done anything to feel guilty about, yet."
2479,"Turns out my friends are staying for the whole show and won't be back til ~ &lt;#&gt; , so feel free to go ahead and smoke that $ &lt;#&gt;  worth"
2494,I am not sure about night menu. . . I know only about noon menu
2508,PRIVATE! Your 2003 Account Statement for 07973788240 shows 800 un-redeemed S. I. M. points. Call 08715203649 Identifier Code: 40533 Expires 31/10/04
2511,I sent you  &lt;#&gt;  bucks
2514,Stupid.its not possible
2520,His frens go then he in lor. Not alone wif my mum n sis lor.
2522,Alex says he's not ok with you not being ok with it
2524,I'm fine. Hope you are also
2527,You getting back any time soon?
2528,My sis is catching e show in e afternoon so i'm not watching w her. So c u wan 2 watch today or tmr lor.
2529,"Huh... Hyde park not in mel ah, opps, got confused... Anyway, if tt's e best choice den we juz have to take it..."
2531,Where @
2535,"Oh ! A half hour is much longer in Syria than Canada, eh ? Wow you must get SO much more work done in a day than us with all that extra time ! *grins*"
2540,I don't run away frm u... I walk slowly &amp; it kills me that u don't care enough to stop me...
2543,i see. When we finish we have loads of loans to pay
2551,"Oh, i will get paid. The most outstanding one is for a commercial i did for Hasbro...in AUGUST! They made us jump through so many hoops to get paid. Still not."
2552,Ok then u tell me wat time u coming later lor.
2564,So now my dad is gonna call after he gets out of work and ask all these crazy questions.
2566,Wat's my dear doing? Sleeping ah?
2569,"Ur balance is now å£600. Next question: Complete the landmark, Big, A. Bob, B. Barry or C. Ben ?. Text A, B or C to 83738. Good luck!"
2572,8007 25p 4 Alfie Moon's Children in Need song on ur mob. Tell ur m8s. Txt TONE CHARITY to 8007 for nokias or POLY CHARITY for polys :zed 08701417012 profit 2 charity 
2575,"K, wen ur free come to my home and also tel vikky i hav sent mail to him also.. Better come evening il be free today aftr 6pm..:-)"
2576,And is there a way you can send shade's stuff to her. And she has been wonderful too.
2578,Oh... Lk tt den we take e one tt ends at cine lor... Dun wan yogasana oso can... 
2579,Ur HMV Quiz cash-balance is currently å£500 - to maximize ur cash-in now send HMV1 to 86688 only 150p/msg
2585,Home so we can always chat
2587,How come it takes so little time for a child who is afraid of the dark to become a teenager who wants to stay out all night?
2588,It is a good thing I'm now getting the connection to bw
2593,No we sell it all so we'll have tons if coins. Then sell our coins to someone thru paypal. Voila! Money back in life pockets:)
2595,Hmm. Shall i bring a bottle of wine to keep us amused? Just joking! I'll still bring a bottle. Red or white? See you tomorrow
2601,Aww that's the first time u said u missed me without asking if I missed u first. You DO love me! :)
2603,"Aight I'll grab something to eat too, text me when you're back at mu"
2607,"Orange customer, you may now claim your FREE CAMERA PHONE upgrade for your loyalty. Call now on 0207 153 9996. Offer ends 14thMarch. T&C's apply. Opt-out availa"
2609,Hey gals...U all wanna meet 4 dinner at nÌÂte? 
2612,Just trying to figure out when I'm suppose to see a couple different people this week. We said we'd get together but I didn't set dates
2616,"Hi, this is Mandy Sullivan calling from HOTMIX FM...you are chosen to receive å£5000.00 in our Easter Prize draw.....Please telephone 09041940223 to claim before 29/03/05 or your prize will be transferred to someone else...."
2618,Still in customer place
2626,Men like shorter ladies. Gaze up into his eyes.
2627,"Every King Was Once A Crying Baby And Every Great Building Was Once A Map.. Not Imprtant Where U r TODAY, BUT Where U Wil Reach TOMORW. Gud ni8"
2631,"Plz note: if anyone calling from a mobile Co. &amp; asks u to type # &lt;#&gt;  or # &lt;#&gt; . Do not do so. Disconnect the call,coz it iz an attempt of 'terrorist' to make use of the sim card no. Itz confirmd by nokia n motorola n has been verified by CNN IBN."
2636,Will do. Have a good day
2637,"Text me when you get off, don't call, my phones having problems"
2640,How much are we getting?
2642,"naughty little thought: 'its better to flirt, flirt n flirt, rather than loving someone n gettin hurt, hurt n hurt...:-) Gud nyt"
2654,"Aight, lemme know what's up"
2656,Nope i waiting in sch 4 daddy... 
2658,Macha dont feel upset.i can assume your mindset.believe me one evening with me and i have some wonderful plans for both of us.LET LIFE BEGIN AGAIN.call me anytime
2665,I am going to sleep. I am tired of travel.
2670,URGENT We are trying to contact you Last weekends draw shows u have won a å£1000 prize GUARANTEED Call 09064017295 Claim code K52 Valid 12hrs 150p pm
2671,HAPPY NEW YEAR MY NO.1 MAN
2687,Hard LIVE 121 chat just 60p/min. Choose your girl and connect LIVE. Call 09094646899 now! Cheap Chat UK's biggest live service. VU BCM1896WC1N3XX
2690,Hey come online! Use msn... We are all there
2691,Ok lor... But buy wat?
2697,Congratulations ur awarded 500 of CD vouchers or 125gift guaranteed & Free entry 2 100 wkly draw txt MUSIC to 87066 TnCs www.Ldew.com1win150ppmx3age16
2707,Mm you ask him to come its enough :-)
2709,Let me know when you've got the money so carlos can make the call
2715,What your plan for pongal?
2717,Dunno lei... I thk mum lazy to go out... I neva ask her yet...
2725,It does it on its own. Most of the time it fixes my spelling. But sometimes it gets a completely diff word. Go figure
2730,You dont know you jabo me abi.
2732,Ok lor. I ned 2 go toa payoh 4 a while 2 return smth u wan 2 send me there or wat?
2735,Any pain on urination any thing else?
2739,Tomarrow final hearing on my laptop case so i cant.
2741,Omg it could snow here tonite!
2744,It certainly puts things into perspective when something like this happens
2749,"This is the 2nd attempt to contract U, you have won this weeks top prize of either å£1000 cash or å£200 prize. Just call 09066361921"
2750,"We know someone who you know that fancies you. Call 09058097218 to find out who. POBox 6, LS15HB 150p"
2753,I.ll hand her my phone to chat wit u
2754,Oh:)as usual vijay film or its different?
2755,"Ya tel, wats ur problem.."
2756,IÛ÷m parked next to a MINI!!!! When are you coming in today do you think?
2763,-PLS STOP bootydelious (32/F) is inviting you to be her friend. Reply YES-434 or NO-434 See her: www.SMS.ac/u/bootydelious STOP? Send STOP FRND to 62468
2770,"\Aww you must be nearly dead!Well Jez isComing over toDo some workAnd that whillTake forever!\"""""
2777,Me fine..absolutly fine
2778,Not tonight mate. Catching up on some sleep. This is my new number by the way. 
2783,"Good afternoon, my love ... How goes your day ? How did you sleep ? I hope your well, my boytoy ... I think of you ..."
2791,You stayin out of trouble stranger!!saw Dave the other day heåÕs sorted now!still with me bloke when u gona get a girl MR!ur mum still Thinks we will get 2GETHA! 
2794,aathi..where are you dear..
2798,Full heat pa:-) i have applyed oil pa.
2800,"Sir Goodmorning, Once free call me."
2805,Nah im goin 2 the wrks with j wot bout u?
2808,Thanks a lot for your wishes on my birthday. Thanks you for making my birthday truly memorable.
2813,thanks for the temales it was wonderful. Thank. Have a great week.
2817,Sorry that was my uncle. I.ll keep in touch
2818,"Tick, tick, tick ... Babe"
2824,He's an adult and would learn from the experience. There's no real danger. I just dont like peeps using drugs they dont need. But no comment
2829,Not a drop in the tank
2831,Hey loverboy! I love you !! I had to tell ... I look at your picture and ache to feel you between my legs ... Fuck I want you ... I need you ... I crave you .
2833,Smith waste da.i wanna gayle.
2840,Ok i found dis pierre cardin one which looks normal costs 20 its on sale.
2841,"URGENT! Your mobile number *************** WON a å£2000 Bonus Caller prize on 10/06/03! This is the 2nd attempt to reach you! Call 09066368753 ASAP! Box 97N7QP, 150ppm"
2842,Rats. Hey did u ever vote for the next themes?
2850,Hey no I ad a crap nite was borin without ya 2 boggy with me u boring biatch! Thanx but u wait til nxt time il ave ya 
2859,What i told before i tell. Stupid hear after i wont tell anything to you. You dad called to my brother and spoken. Not with me.
2874,"I.ll always be there, even if its just in spirit. I.ll get a bb soon. Just trying to be sure i need it."
2876,Wish u many many returns of the day.. Happy birthday vikky..
2879,Stupid auto correct on my phone
2884,Now that you have started dont stop. Just pray for more good ideas and anything i see that can help you guys i.ll forward you a link.
2888,Whatsup there. Dont u want to sleep
2890,"K, can that happen tonight?"
2902,do u think that any girl will propose u today by seing ur bloody funky shit fucking face...............asssssholeeee................
2907,dating:i have had two of these. Only started after i sent a text to talk sport radio last week. Any connection do you think or coincidence?
2914,somewhere out there beneath the pale moon light someone think in of u some where out there where dreams come true... goodnite &amp; sweet dreams
2916,"Hey , is * rite u put åÈ10 evey mnth is that all?"
2921,* Was thinking about chuckin ur red green n black trainners 2 save carryin them bac on train
2924,She doesnt need any test.
2926,Do Ì_ all wan 2 meet up n combine all the parts? How's da rest of da project going?
2929,Ya very nice. . .be ready on thursday
2934,"You at mu? You should try to figure out how much money everyone has for gas and alcohol, jay and I are trying to figure out our weed budget"
2940,We not leaving yet. Ok lor then we go elsewhere n eat. U thk...
2941,Hi Petey!noiåÕm ok just wanted 2 chat coz avent spoken 2 u 4 a long time-hope ur doin alrite.have good nit at js love ya am.x
2944,Yeah we do totes. When u wanna?
2947,"\CHEERS U TEX MECAUSE U WEREBORED! YEAH OKDEN HUNNY R UIN WK SAT?SOUNDåÕS LIKEYOUR HAVIN GR8FUN J! KEEP UPDAT COUNTINLOTS OF LOVEME XXXXX.\"""""
2948,"Fantasy Football is back on your TV. Go to Sky Gamestar on Sky Active and play å£250k Dream Team. Scoring starts on Saturday, so register now!SKY OPT OUT to 88088"
2952,I uploaded mine to Facebook
2954,Cos i want it to be your thing
2956,"Sorry, I'll call later"
2962,All e best 4 ur driving tmr :-)
2972,"URGENT!: Your Mobile No. was awarded a å£2,000 Bonus Caller Prize on 02/09/03! This is our 2nd attempt to contact YOU! Call 0871-872-9755 BOX95QU"
2987,U r too much close to my heart. If u go away i will be shattered. Plz stay with me.
2993,So can collect ur laptop?
2997,If you hear a loud scream in about &lt;#&gt; minutes its cause my Gyno will be shoving things up me that don't belong :/
3003,That is wondar full flim.
3010,"Good! No, donÛ÷t need any receiptsÛÓwell done! (Û_) Yes, please tell . WhatÛ÷s her number, i could ring her"
3011,Ok...
3014,yeah sure thing mate haunt got all my stuff sorted but im going sound anyway promoting hex for .by the way who is this? dont know number. Joke
3030,IM FINE BABES AINT BEEN UP 2 MUCH THO! SAW SCARY MOVIE YEST ITS QUITE FUNNY! WANT 2MRW AFTERNOON? AT TOWN OR MALL OR SUMTHIN?xx
3031,Ok... Take ur time n enjoy ur dinner...
3035,I was wondering if it would be okay for you to call uncle john and let him know that things are not the same in nigeria as they r here. That  &lt;#&gt;  dollars is 2years sent and that you know its a strain but i plan to pay back every dime he gives. Every dime so for me to expect anything from you is not practical. Something like that.
3036,"Auction round 4. The highest bid is now å£54. Next maximum bid is å£71. To bid, send BIDS e. g. 10 (to bid å£10) to 83383. Good luck."
3038,Jay says that you're a double-faggot
3041,I'm at home. Please call
3043,Oh k.i think most of wi and nz players unsold.
3049,Please tell me you have some of that special stock you were talking about
3051,"Hmm ok, i'll stay for like an hour cos my eye is really sore!"
3055,1 I don't have her number and 2 its gonna be a massive pain in the ass and i'd rather not get involved if that's possible
3056,What time you coming down later? 
3062,Yup it's at paragon... I havent decided whether 2 cut yet... Hee...
3064,Tell them the drug dealer's getting impatient
3075,"We are hoping to get away by 7, from Langport. You still up for town tonight?"
3076,Ha ha - had popped down to the loo when you hello-ed me. Hello!
3083,Mind blastin.. No more Tsunamis will occur from now on.. Rajnikant stopped swimming in Indian Ocean..:-D
3087,"Got what it takes 2 take part in the WRC Rally in Oz? U can with Lucozade Energy! Text RALLY LE to 61200 (25p), see packs or lucozade.co.uk/wrc & itcould be u!"
3089,"Edison has rightly said, \A fool can ask more questions than a wise man can answer\"" Now you know why all of us are speechless during ViVa.. GM"
3096,Happy New year my dear brother. I really do miss you. Just got your number and decided to send you this text wishing you only happiness. Abiola
3100,Dunno he jus say go lido. Same time 930.
3101,Life style garments account no please.
3102,Hey morning what you come to ask:-) pa...
3109,I'll be at mu in like  &lt;#&gt;  seconds
3112,Future is not what we planned for tomorrow.....! it is the result of what we do today...! Do the best in present... enjoy the future.
3118,I dled 3d its very imp
3120,Let me know how it changes in the next 6hrs. It can even be appendix but you are out of that age range. However its not impossible. So just chill and let me know in 6hrs
3122,I AM AT A PARTY WITH ALEX NICHOLS
3127,Ok...
3131,How do you plan to manage that
3132,What time do u get out?
3145,U guys never invite me anywhere :(
3146,Ok... C ya...
3150,Am in film ill call you later.
3156,Am i that much dirty fellow?
3157,"[Û_] anyway, many good evenings to u! s"
3158,Yes.. now only saw your message..
3162,I like to talk pa but am not able to. I dont know y.
3168,"My life Means a lot to me, Not because I love my life, But because I love the people in my life, The world calls them friends, I call them my World:-).. Ge:-).."
3171,Love you aathi..love u lot..
3172,"Can you please ask macho what his price range is, does he want something new or used plus it he only interfued in the blackberry bold  &lt;#&gt;  or any bb"
3173,"LOOK AT AMY URE A BEAUTIFUL, INTELLIGENT WOMAN AND I LIKE U A LOT. I KNOW U DONåÕT LIKE ME LIKE THAT SO DONåÕT WORRY."
3174,I know! Grumpy old people. My mom was like you better not be lying. Then again I am always the one to play jokes...
3176,Urgent Ur å£500 guaranteed award is still unclaimed! Call 09066368327 NOW closingdate04/09/02 claimcode M39M51 å£1.50pmmorefrommobile2Bremoved-MobyPOBox734LS27YF
3193,"There're some people by mu, I'm at the table by lambda"
3198,I can ask around but there's not a lot in terms of mids up here
3200,I dont know ask to my brother. Nothing problem some thing that. Just i told .
3201,Beautiful truth : Expression of the face could Be seen by everyone... But the depression of heart Could be understood only By the Loved ones.. Gud Ni8;-)
3203,Did u receive my msg?
3208,No objection. My bf not coming.
3211,WHAT TIME U WRKIN?
3218,"Last Chance! Claim ur å£150 worth of discount vouchers today! Text SHOP to 85023 now! SavaMob, offers mobile! T Cs SavaMob POBOX84, M263UZ. å£3.00 Sub. 16"
3221,"Dont search love, let love find U. Thats why its called falling in love, bcoz U dont force yourself, U just fall and U know there is smeone to hold U... BSLVYL"
3223,Morning only i can ok.
3226,Dont gimme that lip caveboy
3230,Idk. I'm sitting here in a stop and shop parking lot right now bawling my eyes out because i feel like i'm a failure in everything. Nobody wants me and now i feel like i'm failing you.
3234,"Dont worry, 1 day very big lambu ji vl come..til then enjoy batchlor party:-)"
3236,I want to tell you how bad I feel that basically the only times I text you lately are when I need drugs
3241,1 in cbe. 2 in chennai.
3245,FREE for 1st week! No1 Nokia tone 4 ur mob every week just txt NOKIA to 8007 Get txting and tell ur mates www.getzed.co.uk POBox 36504 W45WQ norm150p/tone 16+
3252,"Yo, the game almost over? Want to go to walmart soon"
3255,They are just making it easy to pay back. I have  &lt;#&gt; yrs to say but i can pay back earlier. You get?
3256,I just saw ron burgundy captaining a party boat so yeah
3257,Minimum walk is 3miles a day.
3262,You do got a shitload of diamonds though
3263,"Welcome to Select, an O2 service with added benefits. You can now call our specially trained advisors FREE from your mobile by dialling 402."
3267,Even my brother is not like to speak with me. They treat me like aids patent.
3268,I might come to kerala for 2 days.so you can be prepared to take a leave once i finalise .dont plan any travel during my visit.need to finish urgent works.
3270,YOU ARE CHOSEN TO RECEIVE A å£350 AWARD! Pls call claim number 09066364311 to collect your award which you are selected to receive as a valued mobile customer.
3271,"Good morning, im suffering from fever and dysentry ..will not be able to come to office today."
3277,"No we put party 7 days a week and study lightly, I think we need to draw in some custom checkboxes so they know we're hardcore"
3282,"Yeah hopefully, if tyler can't do it I could maybe ask around a bit"
3283,December only! Had your mobile 11mths+? You are entitled to update to the latest colour camera mobile for Free! Call The Mobile Update Co FREE on 08002986906
3290,Ok going to sleep. Hope i can meet her.
3297,Do I? I thought I put it back in the box
3305,Hows the pain dear?y r u smiling?
3306,"Xmas & New Years Eve tickets are now on sale from the club, during the day from 10am till 8pm, and on Thurs, Fri & Sat night this week. They're selling fast!"
3316,Nice line said by a broken heart- Plz don't cum 1 more times infront of me... Other wise once again I ll trust U... Good 9t:)
3318,Id have to check but there's only like 1 bowls worth left
3321,"Oops - am at my mum's in somerset... Bit far! Back tomo, see you soon x"
3327,"Congrats 2 mobile 3G Videophones R yours. call 09063458130 now! videochat wid ur mates, play java games, Dload polypH music, noline rentl. bx420. ip4. 5we. 150p"
3333,No. Thank you. You've been wonderful
3341,Oh that was a forwarded message. I thought you send that to me
3342,This phone has the weirdest auto correct.
3344,"I am late,so call you tomorrow morning.take care sweet dreams....u and me...ummifying...bye."
3346,"Camera quite good, 10.1mega pixels, 3optical and 5digital dooms. Have a lovely holiday, be safe and i hope you hav a good journey! Happy new year to you both! See you in a couple of weeks! "
3349,I'll reach in ard 20 mins ok...
3351,I borrow ur bag ok.
3353,Hey! There's veggie pizza... :/
3359,"Can you pls pls send me a mail on all you know about relatives coming to deliver here? All you know about costs, risks, benefits and anything else. Thanks."
3360,Leave it wif me lar... ÌÏ wan to carry meh so heavy... Is da num 98321561 familiar to Ì_?
3364,Lol! Nah wasn't too bad thanks. Its good to b home but its been quite a reality check. Hows ur day been? Did u do anything with website?
3368,Guess he wants alone time. We could just show up and watch when they do..
3369,Ummma.will call after check in.our life will begin from qatar so pls pray very hard.
3370,Is ur lecture over?
3371,"Finally it has happened..! Aftr decades..! BEER is now cheaper than PETROL! The goverment expects us to \DRINK\"". . . But don't \""DRIVE \"""""
3374,Baaaaabe! I misss youuuuu ! Where are you ? I have to go and teach my class at 5 ...
3376,The Xmas story is peace.. The Xmas msg is love.. The Xmas miracle is jesus.. Hav a blessed month ahead &amp; wish U Merry Xmas...
3377,Sorry i cant take your call right now. It so happens that there r 2waxsto do wat you want. She can come and ill get her medical insurance. And she'll be able to deliver and have basic care. I'm currently shopping for the right medical insurance for her. So just give me til friday morning. Thats when i.ll see the major person that can guide me to the right insurance.
3381,You see the requirements please
3387,"Mostly sports type..lyk footbl,crckt.."
3390,Aiyo a bit pai seh Ì_ noe... Scared he dun rem who i am then die... Hee... But he become better lookin oredi leh...
3403,He says hi and to get your ass back to south tampa (preferably at a kegger)
3406,Oh shut it. Omg yesterday I had a dream that I had 2 kids both boys. I was so pissed. Not only about the kids but them being boys. I even told mark in my dream that he was changing diapers cause I'm not getting owed in the face.
3411,Dude sux for snake. He got old and raiden got buff
3413,I am hot n horny and willing I live local to you - text a reply to hear strt back from me 150p per msg Netcollex LtdHelpDesk: 02085076972 reply Stop to end
3425,I'm in class. Will holla later
3429, &lt;#&gt;  mins but i had to stop somewhere first.
3430,Noice. Text me when you're here
3432,So do you have samus shoulders yet
3434,No need to ke qi... ÌÏ too bored izzit y suddenly thk of this...
3436,Just sent it. So what type of food do you like?
3439,Ok good then i later come find Ì_... C lucky i told Ì_ to go earlier... Later pple take finish Ì_ no more again...
3441,R Ì_ comin back for dinner?
3443,22 days to kick off! For Euro2004 U will be kept up to date with the latest news and results daily. To be removed send GET TXT STOP to 83222
3461,Lol well don't do it without me. We could have a big sale together.
3462,How come guoyang go n tell her? Then u told her?
3463,Oic... Then better quickly go bathe n settle down...
3476,Then ur physics get a-?
3477,"The house is on the water with a dock, a boat rolled up with a newscaster who dabbles in jazz flute behind the wheel"
3480,Wat makes some people dearer is not just de happiness dat u feel when u meet them but de pain u feel when u miss dem!!!
3482,cool. We will have fun practicing making babies!
3485,"I av a new number,  . Wil u only use this one,ta."
3486,Had your mobile 10 mths? Update to latest Orange camera/video phones for FREE. Save å£s with Free texts/weekend calls. Text YES for a callback orno to opt out
3488,Now? I'm going out 4 dinner soon..
3489,Wishing you a wonderful week.
3490,Just glad to be talking to you.
3492,WINNER!! As a valued network customer you have been selected to receivea å£900 prize reward! To claim call 09061701461. Claim code KL341. Valid 12 hours only.
3500,"Thanks for your ringtone order, reference number X49. Your mobile will be charged 4.50. Should your tone not arrive please call customer services 09065989182. From: [colour=red]text[/colour]TXTstar"
3504,"Yes, i'm small kid.. And boost is the secret of my energy.."
3513,K...k...when will you give treat?
3519,If you have belive me. Come to my home.
3520,"Faith makes things possible,Hope makes things work,Love makes things beautiful,May you have all three this Christmas!Merry Christmas!"
3521,We have new local dates in your area - Lots of new people registered in YOUR AREA. Reply DATE to start now! 18 only www.flirtparty.us REPLYS150
3522,Yeah do! DonÛ÷t stand to close tho- youÛ÷ll catch something!
3523,Yup next stop.
3524,O ic lol. Should play 9 doors sometime yo
3525,That's y i said it's bad dat all e gals know u... Wat u doing now?
3537,Jus finish watching tv... U?
3539,Yeah no probs - last night is obviously catching up with you... Speak soon 
3540,"K will do, addie &amp; I are doing some art so I'll be here when you get home"
3545,Monthly password for wap. mobsi.com is 391784. Use your wap phone not PC.
3546,Dai i downloaded but there is only exe file which i can only run that exe after installing.
3551,"And stop wondering \wow is she ever going to stop tm'ing me ?!\"" because I will tm you whenever I want because you are MINE ... *laughs*"""
3553,"yeah, that's what I was thinking"
3557,Hey what happen de. Are you alright.
3559,I re-met alex nichols from middle school and it turns out he's dealing!
3560,Y so late but i need to go n get da laptop...
3566,Went fast asleep dear.take care.
