ID,v2
1177,"You have won ?1,000 cash or a ?2,000 prize! To claim, call09050000327. T&C: RSTM, SW7 3SS. 150ppm"
1178,"Our dating service has been asked 2 contact U by someone shy! CALL 09058091870 NOW all will be revealed. POBox84, M26 3UZ 150p"
1181,So how are you really. What are you up to. How's the masters. And so on.
1186,Yup...
1190,Hey i will be late ah... Meet you at 945+
1192,Been running but only managed 5 minutes and then needed oxygen! Might have to resort to the roller option!
1193,Yar... I tot u knew dis would happen long ago already.
1197,Our ride equally uneventful - not too many of those pesky cyclists around at that time of night ;).
1198,Can you please send me my aunty's number
1204,I had askd u a question some hours before. Its answer
1207,"Ugh y can't u just apologize, admit u were wrong and ask me to take u back?"
1217,"Please protect yourself from e-threats. SIB never asks for sensitive information like Passwords,ATM/SMS PIN thru email. Never share your password with anybody."
1224,Yes! I am a one woman man! Please tell me your likes and dislikes in bed...
1225,Does uncle timi help in clearing cars
1235,Let there be snow. Let there be snow. This kind of weather brings ppl together so friendships can grow.
1247,Oh ok.. Wat's ur email?
1248,You will be receiving this week's Triple Echo ringtone shortly. Enjoy it!
1249,I told that am coming on wednesday.
1260,Hey happy birthday...
1262,Ok lor.
1263,New TEXTBUDDY Chat 2 horny guys in ur area 4 just 25p Free 2 receive Search postcode or at gaytextbuddy.com. TXT ONE name to 89693
1268,Dude we should go sup again
1271,Err... Cud do. I'm going to  at 8pm. I haven't got a way to contact him until then.
1273,"all the lastest from Stereophonics, Marley, Dizzee Racal, Libertines and The Strokes! Win Nookii games with Flirt!! Click TheMob WAP Bookmark or text WAP to 82468"
1276,Ok then i'll let him noe later n ask him call u tmr...
1282,Is toshiba portege m100 gd?
1283,Joy's father is John. Then John is the NAME of Joy's father. Mandan
1285,"Just got part Nottingham - 3 hrs 63miles. Good thing i love my man so much, but only doing 40mph. Hey ho"
1286,"To the wonderful Okors, have a great month. We cherish you guys and wish you well each day. MojiBiola"
1289,Yeah just open chat and click friend lists. Then make the list. Easy as pie
1291,Purity of friendship between two is not about smiling after reading the forwarded message..Its about smiling just by seeing the name. Gud evng musthu
1295,\alright babe
1299,"Sez, hows u & de arab boy? Hope u r all good give my love 2 evry1 love ya eshxxxxxxxxxxx"
1300,I think it's all still in my car
1304,We will meet soon princess! Ttyl!
1327,S s..first time..dhoni rocks...
1328,U're welcome... Caught u using broken english again...
1329,;-) ok. I feel like john lennon.
1331,:( but your not here....
1333,HEY MATE! HOWS U HONEY?DID U AVE GOOD HOLIDAY? GIMMI DE GOSS!x
1337,"Yes, princess. Are you going to make me moan?"
1344,She.s good. She was wondering if you wont say hi but she.s smiling now. So how are you coping with the long distance
1359,"Its ok., i just askd did u knw tht no?"
1363,Lol I was gonna last month. I cashed some in but I left &lt;#&gt; just in case. I was collecting more during the week cause they announced it on the blog.
1364,Just curious because my cuz asked what I was up to
1368, what number do u live at? Is it 11?
1371,Leave it. U will always be ignorant.
1380,Got it..mail panren paru..
1387,"This weeks SavaMob member offers are now accessible. Just call 08709501522 for details! SavaMob, POBOX 139, LA3 2WU. Only å£1.50/week. SavaMob - offers mobile!"
1391,What time should I tell my friend to be around?
1392,"Ever green quote ever told by Jerry in cartoon \A Person Who Irritates u Always Is the one Who Loves u Vry Much But Fails to Express It...!..!! :-) :-) gud nyt"""
1394,I'll text you when I drop x off
1399,How much for an eighth?
1412,You call him now ok i said call him
1415,i cant talk to you now.i will call when i can.dont keep calling.
1419,"God picked up a flower and dippeditinaDEW, lovingly touched itwhichturnedinto u, and the he gifted tomeandsaid,THIS FRIEND IS 4U"
1420,But i dint slept in afternoon.
1422,Oh ho. Is this the first time u use these type of words
1423,Unlimited texts. Limited minutes.
1428,"Sorry, I'll call later in meeting."
1431,He's really into skateboarding now despite the fact that he gets thrown off of it and winds up with bandages and shit all over his arms every five minutes
1434,Dunno lei he neva say...
1443,Who's there say hi to our drugdealer
1451,3. You have received your mobile content. Enjoy
1453,"Playin space poker, u?"
1454,"Sorry, I'll call you  later. I am in meeting sir."
1458,K come to nordstrom when you're done
1462,"Only just got this message, not ignoring you. Yes, i was. Shopping that is"
1466,Please dont say like that. Hi hi hi
1472,"Fighting with the world is easy, u either win or lose bt fightng with some1 who is close to u is dificult if u lose - u lose if u win - u still lose."
1476,Pandy joined 4w technologies today.he got job..
1483,"Hey... Thk we juz go accordin to wat we discussed yest lor, except no kb on sun... Cos there's nt much lesson to go if we attend kb on sat..."
1485,"Oh fine, I'll be by tonight"
1494,Oh is it? Send me the address
1508,Babe ! What are you doing ? Where are you ? Who are you talking to ? Do you think of me ? Are you being a good boy? Are you missing me? Do you love me ?
1512,"Feb  &lt;#&gt;  is \I LOVE U\"" day. Send dis to all ur \""VALUED FRNDS\"" evn me. If 3 comes back u'll gt married d person u luv! If u ignore dis u will lose ur luv 4 Evr"""
1514,"1000's flirting NOW! Txt GIRL or BLOKE & ur NAME & AGE, eg GIRL ZOE 18 to 8007 to join and get chatting!"
1515,"Just gettin a bit arty with my collages at the mo, well tryin 2 ne way! Got a roast in a min lovely i shall enjoy that!"
1516,And several to you sir.
1517,Why do you ask princess?
1520,Hmm...my uncle just informed me that he's paying the school directly. So pls buy food.
1521,Do you know when dad will be back?
1522,I am in office:)whats the matter..msg me now.i will call you at break:).
1527,"How long has it been since you screamed, princess?"
1530,"Goal! Arsenal 4 (Henry, 7 v Liverpool 2 Henry scores with a simple shot from 6 yards from a pass by Bergkamp to give Arsenal a 2 goal margin after 78 mins."
1534,Ok... Then r we meeting later?
1537,Just finished. Missing you plenty
1543,Yes. Please leave at  &lt;#&gt; . So that at  &lt;#&gt;  we can leave
1546,I am on the way to ur home
1552,watever reLation u built up in dis world only thing which remains atlast iz lonlines with lotz n lot memories! feeling..
1557,Yes just finished watching days of our lives. I love it.
1560,cud u tell ppl im gona b a bit l8 cos 2 buses hav gon past cos they were full & im still waitin 4 1. Pete x
1564,Can you let me know details of fri when u find out cos I'm not in tom or fri. mentionned chinese. Thanks
1565,Tell your friends what you plan to do on Valentines day @ &lt;URL&gt;
1568,\Si.como no?!listened2the plaid album-quite gd&the new air1 which is hilarious-also boughtåÓbraindanceåÓa comp.ofstuff on aphexåÕs ;abel
1570,I've got it down to a tea. not sure which flavour
1572,"URGENT, IMPORTANT INFORMATION FOR O2 USER. TODAY IS YOUR LUCKY DAY! 2 FIND OUT WHY LOG ONTO HTTP://WWW.URAWINNER.COM THERE IS A FANTASTIC SURPRISE AWAITING FOR YOU"
1574,Collect your VALENTINE'S weekend to PARIS inc Flight & Hotel + å£200 Prize guaranteed! Text: PARIS to No: 69101. www.rtf.sphosting.com
1581,Good. Good job. I like entrepreneurs
1582,Are you ok. What happen to behave like this
1587,"Multiply the numbers independently and count decimal points then, for the division, push the decimal places like i showed you."
1591,What you doing?how are you?
1594,PRIVATE! Your 2004 Account Statement for 078498****7 shows 786 unredeemed Bonus Points. To claim call 08719180219 Identifier Code: 45239 Expires 06.05.05
1596,500 free text msgs. Just text ok to 80488 and we'll credit your account
1598,Haha... Really oh no... How? Then will they deduct your lesson tmr?
1608,"Japanese Proverb: If one Can do it, U too Can do it, If none Can do it,U must do it Indian version: If one Can do it, LET HIM DO it.. If none Can do it,LEAVE it!! And finally Kerala version: If one can do it, Stop him doing it.. If none can do it, Make a strike against it ..."
1616,I dont know exactly could you ask chechi.
1621,Is ur paper in e morn or aft tmr?
1623,"By the way, 'rencontre' is to meet again. Mountains dont...."
1626,Have you heard from this week?
1633,Waiting 4 my tv show 2 start lor... U leh still busy doing ur report?
1643,K.k.how is your business now?
1645,"Jay wants to work out first, how's 4 sound?"
1652,"Now u sound like manky scouse boy steve,like! I is travelling on da bus home.wot has u inmind 4 recreation dis eve?"
1659,Ummmmmaah Many many happy returns of d day my dear sweet heart.. HAPPY BIRTHDAY dear
1663,Ok give me 5 minutes I think I see her. BTW you're my alibi. You were cutting my hair the whole time.
1667,"My painful personal thought- \I always try to keep everybody happy all the time. But nobody recognises me when i am alone\"""""
1670,Your opinion about me? 1. Over 2. Jada 3. Kusruthi 4. Lovable 5. Silent 6. Spl character 7. Not matured 8. Stylish 9. Simple Pls reply..
1671,"Got ur mail Dileep.thank you so muchand look forward to lots of support...very less contacts here,remember one venugopal you mentioned.tomorrow if not late,i shall try to come up till there.goodnight dear."
1676,Great NEW Offer - DOUBLE Mins & DOUBLE Txt on best Orange tariffs AND get latest camera phones 4 FREE! Call MobileUpd8 free on 08000839402 NOW! or 2stoptxt T&Cs
1681,Get down in gandhipuram and walk to cross cut road. Right side &lt;#&gt; street road and turn at first right.
1684,u r a winner U ave been specially selected 2 receive å£1000 cash or a 4* holiday (flights inc) speak to a live operator 2 claim 0871277810710p/min (18 )
1689,Take some small dose tablet for fever
1692,o turns out i had stereo love on mi phone under the unknown album.
1693,Dunno cos i was v late n when i reach they inside already... But we ate spageddies lor... It's e gals who r laughing at me lor...
1697,UR GOING 2 BAHAMAS! CallFREEFONE 08081560665 and speak to a live operator to claim either Bahamas cruise ofå£2000 CASH 18+only. To opt out txt X to 07786200117
1699,Asking do u knw them or nt? May be ur frnds or classmates?
1701,"Dear all, as we know  &lt;#&gt; th is the  &lt;#&gt; th birthday of our loving Gopalettan. We are planning to give a small gift on that day. Those who like to participate in that you are welcome. Please contact our admin team for more details"
1703,"Hi. Hope ur day * good! Back from walk, table booked for half eight. Let me know when ur coming over."
1706,Just send a text. We'll skype later.
1707,"Congratulations - Thanks to a good friend U have WON the å£2,000 Xmas prize. 2 claim is easy, just call 08712103738 NOW! Only 10p per minute. BT-national-rate"
1709,"YOUR CHANCE TO BE ON A REALITY FANTASY SHOW call now = 08707509020 Just 20p per min NTT Ltd, PO Box 1327 Croydon CR9 5WB 0870 is a national = rate call"
1719,K.k.this month kotees birthday know?
1722,I'm going 4 lunch now wif my family then aft dat i go str 2 orchard lor.
1723,I dunno until when... Lets go learn pilates...
1727,Hi.:)technical support.providing assistance to us customer through call and email:)
1737,December only! Had your mobile 11mths+? You are entitled to update to the latest colour camera mobile for Free! Call The Mobile Update VCo FREE on 08002986906 
1742,What time. IÛ÷m out until prob 3 or so
1743,Probably money worries. Things are coming due and i have several outstanding invoices for work i did two and three months ago.
1747,Sounds better than my evening im just doing my costume. Im not sure what time i finish tomorrow but i will txt you at the end.
1750,"Final Chance! Claim ur å£150 worth of discount vouchers today! Text YES to 85023 now! SavaMob, member offers mobile! T Cs SavaMob POBOX84, M263UZ. å£3.00 Subs 16"
1751,Hard LIVE 121 chat just 60p/min. Choose your girl and connect LIVE. Call 09094646899 now! Cheap Chat UK's biggest live service. VU BCM1896WC1N3XX
1753,I dunno lei... Like dun haf...
1754,East coast
1756,I think its far more than that but find out. Check google maps for a place from your dorm.
1764,Gudnite....tc...practice going on
1766,U still havent got urself a jacket ah?
1768,Ok lar... Joking wif u oni...
1772,"To review and KEEP the fantastic Nokia N-Gage game deck with Club Nokia, go 2 www.cnupdates.com/newsletter. unsubscribe from alerts reply with the word OUT"
1773,Yup ok thanx...
1779,Lol for real. She told my dad I have cancer
1787,Yes. It's all innocent fun. O:-)
1790,So dont use hook up any how
1791,At WHAT TIME should i come tomorrow
1801,Goodnight da thangam I really miss u dear.
1805,K:)i will give my kvb acc details:)
1817,Double eviction this week - Spiral and Michael and good riddance to them!
1818,And now electricity just went out fml.
1820,Oh for fuck's sake she's in like tallahassee
1825,I enjoy watching and playing football and basketball. Anything outdoors. And you?
1827,Can not use foreign stamps in this country.
1830,Hope you are having a great new semester. Do wish you the very best. You are made for greatness.
1832,But you dint in touch with me.
1834,Tessy..pls do me a favor. Pls convey my birthday wishes to Nimya..pls dnt forget it. Today is her birthday Shijas
1838,"Its good, we'll find a way"
1840,Hello which the site to download songs its urgent pls
1841,Ever thought about living a good life with a perfect partner? Just txt back NAME and AGE to join the mobile community. (100p/SMS)
1849,Hello handsome ! Are you finding that job ? Not being lazy ? Working towards getting back that net for mummy ? Where's my boytoy now ? Does he miss me ?
1851,When/where do I pick you up
1853,What is this 'hex' place you talk of? Explain!
1854,Fine am simply sitting.
1856,How dare you change my ring
1860,If we win its really no 1 side for long time.
1862,Hope youåÕre not having too much fun without me!! see u tomorrow love jess x
1866,Yar i wanted 2 scold u yest but late already... I where got zhong se qing you? If u ask me b4 he ask me then i'll go out w u all lor. N u still can act so real.
1868,"Wishing you and your family Merry \X\"" mas and HAPPY NEW Year in advance.."""
1871,"We're all getting worried over here, derek and taylor have already assumed the worst"
1888,Er mw im filled tuth is aight
1890,Sorry de i went to shop.
1892,Ok. Every night take a warm bath drink a cup of milk and you'll see a work of magic. You still need to loose weight. Just so that you know
1893,"\Im on gloucesterroad what are uup to later?\"""""
1901,Miles and smiles r made frm same letters but do u know d difference..? smile on ur face keeps me happy even though I am miles away from u.. :-)keep smiling.. Good nyt
1907,IM GONNAMISSU SO MUCH!!I WOULD SAY IL SEND U A POSTCARD BUTTHERES ABOUTAS MUCH CHANCE OF MEREMEMBERIN ASTHERE IS OFSI NOT BREAKIN HIS CONTRACT!! LUV Yaxx
1917,MAKE SURE ALEX KNOWS HIS BIRTHDAY IS OVER IN FIFTEEN MINUTES AS FAR AS YOU'RE CONCERNED
1922,Hey gals.. Anyone of u going down to e driving centre tmr?
1927,This message is from a great Doctor in India:-): 1) Do not drink APPY FIZZ. It contains Cancer causing age
1929,Anything lor is she coming?
1932,I hope you arnt pissed off but id would really like to see you tomorrow. Love me xxxxxxxxxxxxxX
1934,Txt: CALL to No: 86888 & claim your reward of 3 hours talk time to use from your phone now! Subscribe6GBP/mnth inc 3hrs 16 stop?txtStop www.gamb.tv
1935,I ask if u meeting da ge tmr nite...
1937,What r u cooking me for dinner?
1940,Double Mins & Double Txt & 1/2 price Linerental on Latest Orange Bluetooth mobiles. Call MobileUpd8 for the very latest offers. 08000839402 or call2optout/LF56
1941,Gam gone after outstanding innings.
1943,Waaaat?? Lololo ok next time then!
1947,I donno its in your genes or something
1950,"Yep, by the pretty sculpture"
1954,For real tho this sucks. I can't even cook my whole electricity is out. And I'm hungry.
1958,Can you just come in for a sec? There's somebody here I want you to see
1959,"Not yet chikku..going to room nw, i'm in bus.."
1961,Arun can u transfr me d amt
1966,Taka lor. Wat time u wan 2 come n look 4 us?
1973,Lol I have to take it. member how I said my aunt flow didn't visit for 6 months? It's cause I developed ovarian cysts. Bc is the only way to shrink them.
1975,Its normally hot mail. Com you see!
1980,After the drug she will be able to eat.
1983,Not yet chikku..wat abt u?
1987,"U wake up already? Wat u doing? U picking us up later rite? I'm taking sq825, reaching ard 7 smth 8 like dat. U can check e arrival time. C ya soon..."
1990,Oh dang! I didn't mean o send that to you! Lol!
1991,Auntie huai juan never pick up her phone
1997,"I call you later, don't have network. If urgnt, sms me."
2000,Usually the person is unconscious that's in children but in adults they may just behave abnormally. I.ll call you now
2010,Hey mr whats the name of that bill brison book the one about language and words 
2013,No message..no responce..what happend?
2014,After completed degree. There is no use in joining finance.
2018,When can Ì_ come out?
2027,I want to go to perumbavoor
2028,If he started searching he will get job in few days.he have great potential and talent.
2030,Probably gonna swing by in a wee bit
2031,Y Ì_ wan to go there? C doctor?
2034,"Friendship is not a game to play, It is not a word to say, It doesn\'t start on March and ends on May, It is tomorrow, yesterday, today and e"
2039,Dear we got  &lt;#&gt;  dollars hi hi
2044,I'll pick you up at about 5.15pm to go to taunton if you still want to come.
2050,"Good afternoon sunshine! How dawns that day ? Are we refreshed and happy to be alive? Do we breathe in the air and smile ? I think of you, my love ... As always"
2061,Yes:)sura in sun tv.:)lol.
2067,Can Ì_ send me a copy of da report?
2072,Is it your yahoo boys that bring in the perf? Or legal.
2076,Do you want 750 anytime any network mins 150 text and a NEW VIDEO phone for only five pounds per week call 08002888812 or reply for delivery tomorrow
2079,In fact when do you leave? I think addie goes back to school tues or wed
2085,You are right though. I can't give you the space you want and need. This is really starting to become an issue. I was going to suggest setting a definite move out--if i'm still there-- after greece. But maybe you are ready and should do it now.
2088,Ok lor... Or u wan me go look 4 u?
2090,Lol great now im getting hungry.
2092,Are you up for the challenge? I know i am :)
2101,"I'm an actor. When i work, i work in the evening and sleep late. Since i'm unemployed at the moment, i ALWAYS sleep late. When you're unemployed, every day is saturday."
2103,"Alright, we're all set here, text the man"
2105,That is wondarfull song
2107,money!!! you r a lucky winner ! 2 claim your prize text money 2 88600 over å£1million to give away ! ppt150x3+normal text rate box403 w1t1jy
2112,"Hello, my love! How goes that day ? I wish your well and fine babe and hope that you find some job prospects. I miss you, boytoy ... *a teasing kiss*"
2119,Yes but I don't care cause I know its there!
2125,If I die I want u to have all my stuffs.
2132,Why didn't u call on your lunch?
2148,"URGENT! Your Mobile No 07808726822 was awarded a å£2,000 Bonus Caller Prize on 02/09/03! This is our 2nd attempt to contact YOU! Call 0871-872-9758 BOX95QU"
2149,Lul im gettin some juicy gossip at the hospital. Two nurses are talking about how fat they are gettin. And one thinks shes obese. Oyea.
2153,PRIVATE! Your 2003 Account Statement for shows 800 un-redeemed S. I. M. points. Call 08718738002 Identifier Code: 48922 Expires 21/11/04
2155,I thk u dun haf 2 hint in e forum already lor... Cos i told ron n darren is going 2 tell shuhui.
2163,Yes we were outside for like 2 hours. And I called my whole family to wake them up cause it started at 1 am
2166,"Especially since i talk about boston all up in my personal statement, lol! I woulda changed that if i had realized it said nyc! It says boston now."
2176,Does daddy have a bb now.
2178,Call me when u're done...
2183,"Call me, i am senthil from hsbc."
2185,That was random saw my old roomate on campus. He graduated
2189,Hmmm.still we dont have opener?
2190,Lil fever:) now fine:)
2191,Let me know if you need anything else. Salad or desert or something... How many beers shall i get?
2194,Yup i'm still having coffee wif my frens... My fren drove she'll give me a lift...
2195,"&lt;#&gt; %of pple marry with their lovers... becz they hav gud undrstndng dat avoids problems. i sent dis 2 u, u wil get gud news on friday by d person you like. And tomorrow will be the best day of your life. Dont break this chain. If you break you will suffer. send this to  &lt;#&gt;  frnds in &lt;#&gt;  mins whn u read..."
2197,Yup... I havent been there before... You want to go for the yoga? I can call up to book 
2202,"Each Moment in a day,has its own value-Morning brings hope,afternoon brings faith,Evening brings luv,Night brings rest,Wish u find them all today.Good Morning"
2205,ree entry in 2 a weekly comp for a chance to win an ipod. Txt POD to 80182 to get entry (std txt rate) T&C's apply 08452810073 for details 18+
2208,If I get there before you after your ten billion calls and texts so help me god
2213,One day a crab was running on the sea shore..The waves came n cleared the footprints of the crab.. Crab asked: being my frnd y r u clearing my beautiful footprints? Waves replied: A fox was following ur footprints to catch you! thats y i cleared it off:) frndsship never lets u dwn :-) GUD nyt..
2215,So wat's da decision?
2217,Yup but it's not giving me problems now so mayb i'll jus leave it...
2218,Ur cash-balance is currently 500 pounds - to maximize ur cash-in now send GO to 86688 only 150p/msg. CC: 08718720201 PO BOX 114/14 TCR/W1
2224,"Dear,shall mail tonite.busy in the street,shall update you tonite.things are looking ok.varunnathu edukkukayee raksha ollu.but a good one in real sense."
2225,Super msg da:)nalla timing.
2229,No go. No openings for that room 'til after thanksgiving without an upcharge.
2230,Ha ha ha good joke. Girls are situation seekers.
2233,"Dear Voucher Holder, To claim this weeks offer, at you PC please go to http://www.e-tlp.co.uk/expressoffer Ts&Cs apply. To stop texts, txt STOP to 80062"
2240,"Sorry pa, i dont knw who ru pa?"
2241,"I'm in a meeting, call me later at"
2244,Havent stuck at orchard in my dad's car. Going 4 dinner now. U leh? So r they free tonight?
2245,Sir send to group mail check it.
2248,staff.science.nus.edu.sg/~phyhcmk/teaching/pc1323
2251,No other Valentines huh? The proof is on your fb page. Ugh I'm so glad I really DIDN'T watch your rupaul show you TOOL!
2260,Prof: you have passed in all the papers in this sem congrats . . . . Student: Enna kalaachutaarama..!! Prof:???? Gud mrng!
2261,Dunno i juz askin cos i got a card got 20% off 4 a salon called hair sense so i tot it's da one Ì_ cut ur hair. 
2263,Hi dear we saw dear. We both are happy. Where you my battery is low
2266,Did u got that persons story
2267,Sunshine Quiz Wkly Q! Win a top Sony DVD player if u know which country the Algarve is in? Txt ansr to 82277. å£1.50 SP:Tyrone
2268,I went to project centre
2273,K:)eng rocking in ashes:)
2279,Dear good morning now only i am up
2285,"Once a fishrman woke early in d mrng. It was very dark. He waited a while &amp; found a sack ful of stones. He strtd throwin thm in2 d sea 2 pass time. Atlast he had jus 1stone, sun rose up &amp; he found out tht those r nt stones, those were diamonds. Moral:\Dont wake up early in d mrng'' GOOD night"""
2294,Wat r u doing?
2295,Eh u remember how 2 spell his name... Yes i did. He v naughty make until i v wet.
2312,Those cocksuckers. If it makes you feel better ipads are worthless garbage novelty items and you should feel bad for even wanting one
2315,"HEY THERE BABE, HOW U DOIN? WOT U UP 2 2NITE LOVE ANNIE X."
2316,"Say this slowly.? GOD,I LOVE YOU &amp; I NEED YOU,CLEAN MY HEART WITH YOUR BLOOD.Send this to Ten special people &amp; u c miracle tomorrow, do it,pls,pls do it..."
2324,Then dun wear jeans lor...
2325,"She said,'' do u mind if I go into the bedroom for a minute ? '' ''OK'', I sed in a sexy mood. She came out 5 minuts latr wid a cake...n My Wife,"
2326,Da my birthdate in certificate is in april but real date is today. But dont publish it. I shall give you a special treat if you keep the secret. Any way thanks for the wishes
2330,Of course. I guess god's just got me on hold right now.
2339,Yup... From what i remb... I think should be can book... 
2340,"Usf I guess, might as well take 1 car"
2341,Take care and sleep well.you need to learn to change in life.you only need to get CONVINCED on that.i will wait but no more conversations between us.GET CONVINCED by that time.Your family is over for you in many senses.respect them but not overemphasise.or u have no role in my life.
2347,Dont worry. I guess he's busy.
2351,"Living is very simple.. Loving is also simple.. Laughing is too simple.. Winning is tooo simple.. But, being 'SIMPLE' is very difficult.. Gud nte.:-"
2356,I am late. I will be there at
2358,On the way to office da..
2360,"Have a lovely night and when you wake up to see this message, i hope you smile knowing all is as should be. Have a great morning"
2365,Thanks for loving me so. You rock
2369,Mystery solved! Just opened my email and he's sent me another batch! Isn't he a sweetie
2370,Cancel cheyyamo?and get some money back?
2371,tells u 2 call 09066358152 to claim å£5000 prize. U have 2 enter all ur mobile & personal details @ the prompts. Careful!
2373,V nice! Off 2 sheffield tom 2 air my opinions on categories 2 b used 2 measure ethnicity in next census. Busy transcribing. :-)
